[
  {
    "name": "Seznik Portable Mini Sealing Machine, Handheld Packet Sealer for Food, Snacks, Chips, Fresh Storage, Plastic Bags Sealing Machine, 1 YEAR Warranty (Dark Blue)",
    "asin": "B0D4KJYKNS",
    "price": "₹329",
    "original_price": "₹1,200",
    "discount": "73%",
    "rating": "3.8",
    "image_url": "https://m.media-amazon.com/images/I/71erYLVtXtL._SX679_.jpg",
    "affiliate_link": "https://www.amazon.in/dp/B0D4KJYKNS?tag=pandaloon-21",
    "caption": "🔥 SUPER DEAL ALERT! 🔥\n\nSeznik Portable Mini Sealing Machine - Keep Your Snacks Fresh!\n\n💥 73% OFF - LIMITED TIME!\n💰 Just ₹329 (was ₹1,200)\n⭐ Rated 3.8/5 stars\n🔒 1 YEAR WARRANTY\n\n✨ Why You Need This:\n• Perfect for chips, snacks & food storage\n• Handheld & portable design\n• Keeps food fresh longer\n• Easy to use anywhere\n• 1K+ bought last month!\n\n🛒 GRAB THIS DEAL NOW:\n👉 Link in bio\n🔗 https://www.amazon.in/dp/B0D4KJYKNS?tag=pandaloon-21\n\n⏰ Limited stock - Order today!\n\n#KitchenGadgets #FoodStorage #AmazonDeals #India #Shopping #Deals #Discount #OnlineShopping #BestPrice #FlashSale #LimitedOffer #PandaLoon #ShopNow #LinkInBio #KitchenHacks #FreshFood",
    "scraped_at": "2025-08-06 18:45:00"
  }
]